{
  "schema_version": 1,
  "matrix_id": "rayd_edge_bvh_v1",
  "benchmark": "rayd_edge_bvh",
  "seed": 20260711,
  "profile": "full",
  "environment": {
    "gpu_name": "NVIDIA GeForce RTX 5080",
    "gpu_compute_capability": "12.0",
    "cuda_runtime_version": "12.9",
    "cuda_driver_version": "596.49",
    "optix_version": "8.1.0",
    "compiler_id": "MSVC",
    "compiler_version": "19.44.35207.1",
    "build_type": "Release",
    "git_commit": "f8bda6a39ae4e387cad0e647e2082054dd1dc9fe"
  },
  "tolerances": {
    "correctness": {
      "max_abs_error": 1e-05,
      "max_rel_error": 1e-05
    },
    "ad": {
      "vjp_max_abs_error": 0.0005,
      "vjp_max_rel_error": 0.0005,
      "jvp_max_abs_error": 0.0005,
      "jvp_max_rel_error": 0.0005
    }
  },
  "cases": [
    {
      "case_id": "1000-1-point-1-static-sparse-grid",
      "dimensions": {
        "edge_count": 1000,
        "query_count": 1,
        "query_kind": "point",
        "top_k": 1,
        "update_mode": "static",
        "mask": "sparse",
        "distribution": "grid"
      },
      "performance": {
        "hot_query_ms": {
          "unit": "ms",
          "samples": [
            9.887299995170906,
            20.21220000460744,
            20.207900000968948,
            44.532399988383986,
            17.864800000097603
          ],
          "median": 20.207900000968948,
          "p95": 44.532399988383986
        },
        "build_ms": {
          "unit": "ms",
          "samples": [
            6652.604999995674,
            201.47660000657197,
            315.6807000050321,
            468.6887999996543,
            211.3180000014836
          ],
          "median": 315.6807000050321,
          "p95": 6652.604999995674
        },
        "refit_ms": {
          "unit": "ms",
          "samples": [
            0.002700006007216871,
            0.0053000112529844046,
            0.0040000013541430235,
            0.003200009814463556,
            0.00340001133736223
          ],
          "median": 0.00340001133736223,
          "p95": 0.0053000112529844046
        },
        "peak_device_memory_bytes": {
          "unit": "bytes",
          "samples": [
            346030080.0,
            346030080.0,
            346030080.0,
            346030080.0,
            346030080.0
          ],
          "median": 346030080.0,
          "p95": 346030080.0
        },
        "cold_create_ms": {
          "unit": "ms",
          "samples": [
            7488.194000005024,
            6881.262800001423,
            6853.361500005121,
            10728.76169999654,
            10503.759100000025
          ],
          "median": 7488.194000005024,
          "p95": 10728.76169999654
        }
      },
      "correctness": {
        "max_abs_error": 0.0,
        "max_rel_error": 0.0
      },
      "ad": {
        "vjp_max_abs_error": 0.0,
        "vjp_max_rel_error": 0.0,
        "jvp_max_abs_error": 0.0,
        "jvp_max_rel_error": 0.0
      }
    },
    {
      "case_id": "16000-1-point-1-static-sparse-grid",
      "dimensions": {
        "edge_count": 16000,
        "query_count": 1,
        "query_kind": "point",
        "top_k": 1,
        "update_mode": "static",
        "mask": "sparse",
        "distribution": "grid"
      },
      "performance": {
        "hot_query_ms": {
          "unit": "ms",
          "samples": [
            177.54360000253655,
            129.60089999251068,
            221.74229999654926,
            246.16880000394303,
            322.3827999900095
          ],
          "median": 221.74229999654926,
          "p95": 322.3827999900095
        },
        "build_ms": {
          "unit": "ms",
          "samples": [
            11901.378499998827,
            459.5356000063475,
            438.81469999905676,
            2522.28560000367,
            373.88829998963047
          ],
          "median": 459.5356000063475,
          "p95": 11901.378499998827
        },
        "refit_ms": {
          "unit": "ms",
          "samples": [
            0.006200003554113209,
            0.003100009053014219,
            0.007800001185387373,
            0.00549999822396785,
            0.00650000583846122
          ],
          "median": 0.006200003554113209,
          "p95": 0.007800001185387373
        },
        "peak_device_memory_bytes": {
          "unit": "bytes",
          "samples": [
            346030080.0,
            346030080.0,
            346030080.0,
            346030080.0,
            346030080.0
          ],
          "median": 346030080.0,
          "p95": 346030080.0
        },
        "cold_create_ms": {
          "unit": "ms",
          "samples": [
            9352.834999997867,
            9647.406300005969,
            8048.038199995062,
            9105.61269999016,
            7884.399899994605
          ],
          "median": 9105.61269999016,
          "p95": 9647.406300005969
        }
      },
      "correctness": {
        "max_abs_error": 0.0,
        "max_rel_error": 0.0
      },
      "ad": {
        "vjp_max_abs_error": 0.0,
        "vjp_max_rel_error": 0.0,
        "jvp_max_abs_error": 0.0,
        "jvp_max_rel_error": 0.0
      }
    },
    {
      "case_id": "64000-1-point-1-static-sparse-grid",
      "dimensions": {
        "edge_count": 64000,
        "query_count": 1,
        "query_kind": "point",
        "top_k": 1,
        "update_mode": "static",
        "mask": "sparse",
        "distribution": "grid"
      },
      "performance": {
        "hot_query_ms": {
          "unit": "ms",
          "samples": [
            206.60610000777524,
            7307.132299989462,
            702.9497000039555,
            629.7702000010759,
            481.3953999982914
          ],
          "median": 629.7702000010759,
          "p95": 7307.132299989462
        },
        "build_ms": {
          "unit": "ms",
          "samples": [
            9005.93640000443,
            395.21539999987,
            486.00099999748636,
            452.8435999964131,
            1112.3228999931598
          ],
          "median": 486.00099999748636,
          "p95": 9005.93640000443
        },
        "refit_ms": {
          "unit": "ms",
          "samples": [
            0.00859999272506684,
            0.002800006768666208,
            0.004599991370923817,
            0.013500000932253897,
            0.0030999945010989904
          ],
          "median": 0.004599991370923817,
          "p95": 0.013500000932253897
        },
        "peak_device_memory_bytes": {
          "unit": "bytes",
          "samples": [
            379584512.0,
            379584512.0,
            379584512.0,
            379584512.0,
            379584512.0
          ],
          "median": 379584512.0,
          "p95": 379584512.0
        },
        "cold_create_ms": {
          "unit": "ms",
          "samples": [
            8358.516700012842,
            7955.4406000097515,
            7461.017800000263,
            7116.750100001809,
            6931.650999991689
          ],
          "median": 7461.017800000263,
          "p95": 8358.516700012842
        }
      },
      "correctness": {
        "max_abs_error": 0.0,
        "max_rel_error": 0.0
      },
      "ad": {
        "vjp_max_abs_error": 0.0,
        "vjp_max_rel_error": 0.0,
        "jvp_max_abs_error": 0.0,
        "jvp_max_rel_error": 0.0
      }
    },
    {
      "case_id": "111000-1-point-1-static-sparse-grid",
      "dimensions": {
        "edge_count": 111000,
        "query_count": 1,
        "query_kind": "point",
        "top_k": 1,
        "update_mode": "static",
        "mask": "sparse",
        "distribution": "grid"
      },
      "performance": {
        "hot_query_ms": {
          "unit": "ms",
          "samples": [
            54.229499990469776,
            68.88950000575278,
            61.22460000915453,
            134.73840001097415,
            103.00319999805652
          ],
          "median": 68.88950000575278,
          "p95": 134.73840001097415
        },
        "build_ms": {
          "unit": "ms",
          "samples": [
            6765.796499996213,
            398.70459999656305,
            481.60279999137856,
            453.8925999950152,
            497.3743000009563
          ],
          "median": 481.60279999137856,
          "p95": 6765.796499996213
        },
        "refit_ms": {
          "unit": "ms",
          "samples": [
            0.0026000052457675338,
            0.0030999945010989904,
            0.0032999960239976645,
            0.0029999937396496534,
            0.008899995009414852
          ],
          "median": 0.0030999945010989904,
          "p95": 0.008899995009414852
        },
        "peak_device_memory_bytes": {
          "unit": "bytes",
          "samples": [
            167772160.0,
            167772160.0,
            167772160.0,
            167772160.0,
            167772160.0
          ],
          "median": 167772160.0,
          "p95": 167772160.0
        },
        "cold_create_ms": {
          "unit": "ms",
          "samples": [
            8110.176299989689,
            6992.545100001735,
            7450.422699999763,
            7357.640400005039,
            15949.499899987131
          ],
          "median": 7450.422699999763,
          "p95": 15949.499899987131
        }
      },
      "correctness": {
        "max_abs_error": 0.0,
        "max_rel_error": 0.0
      },
      "ad": {
        "vjp_max_abs_error": 0.0,
        "vjp_max_rel_error": 0.0,
        "jvp_max_abs_error": 0.0,
        "jvp_max_rel_error": 0.0
      }
    },
    {
      "case_id": "500000-1-point-1-static-sparse-grid",
      "dimensions": {
        "edge_count": 500000,
        "query_count": 1,
        "query_kind": "point",
        "top_k": 1,
        "update_mode": "static",
        "mask": "sparse",
        "distribution": "grid"
      },
      "performance": {
        "hot_query_ms": {
          "unit": "ms",
          "samples": [
            164.61890000209678,